line,annotated
[Couplet 1: Kery James],0
"Kery James est de retour, pose le micro t'es fou",1
"Et si tu veux me faire taire, pose de la nitro, c'est tout",1
"Tu peux assassiner l'homme, mes écrits te survivront",1
Mais on ne tire pas au gomme-cogne sur le dernier MC vivant,1
Pop-pop c'est le retour du rap français,1
Qui fait bouger les cœurs et les têtes avant les fessiers,1
"1 pour l'éducation car sans elle pas d'élévation, encore moins de révolution",1
Qui prétend faire du rap sans prendre position ?,1
"Eh ! Ça n'a pas de sens, j'suis venu en secouriste",1
Réanimer les consciences que les faux MCs abrutissent,1
Trop grande est notre influence dans les quartiers à hauts risques,1
"À part compter leur redevance, à quoi leur rimes aboutissent ?",1
Tu sais c'que j'pense des pseudos-gangsters,1
En quête d'une seule réponse : qui sera le plus riche du cimetière ?,1
"Tu retardes pas l'temps avec ta Rolex, MC",1
T'es quand même mort dans un cercueil Gucci,1
[Couplet 2: Kery James],0
"Eh ! La rue me soutient, la rue se souvient",1
"Depuis ""La Vie est brutale"",",1
elle sait qu'j'suis sur une mission,1
Je n'ai jamais baissé mon futal au détriment de mes ambitions,1
"Et même quand j'étais plongé, dans un nuage de fumée",1
J'avais déjà mal au cœur,1
en chantant le Ghetto Français,1
J'étais bloqué dans l'Impasse,1
sur une voix à Deux Issues,1
"Tant que les miens ne seront pas en place,",1
pour moi le combat continue,1
"Banlieusard et fier de l'être,",1
eh ! Tu sais que j'représente,1
"Ma Vérité contre un chèque ? Quoi, crois-tu que je plaisante ?",1
"J'suis lié au hardcore, et j'le serais jusqu'à la mort",1
"Thug life, hardcore jusqu'à la mort, Génération Sacrifiée, demande à mon frère des Comores",1
"Vingt ans de carrière, vingt ans de classiques, t'y-t'y-t'y es",1
Ils se demandent comment faire taire le plus africain des An-ti-tillais,1
Tout le monde ne peut pas le faire et rester-ter-ter entier,0
"Fais-fais un pas en arrière, ou tire au canon sci-scillé",1
"Rappelle toi qu'en 2006, personne ne voulait me si-signer",1
"Que disait-on dans les maisons de disque ? ""Kery James c'est-c'est terminé""",1
"Mais eux se sont faits-faits virer,",0
"quant à moi, j'ai pas fini",1
Et si le public me suit : 2013 j'serai à Bercy,1
[Couplet 3: Kery James],0
Pour devenir un MC suffit pas d'en avoir l'ambition,1
"S'exhiber dans la rue, à moitié nu en faisant des tractions",1
Le truc tourne vite en rond quand t'as que la haine comme inspiration,0
À quoi bon faire des menaces si tu rappes des dépositions ?,1
"Frangin, y'aura pas de refrain",1
et y'en aura pour tout le monde,1
Les prédateurs ont faim mais j'suis un agneau qui sait se défendre,0
"Le brutal peut être la fin, je sais que je risque de me faire descendre",0
Et qu'ça peut sentir le sapin bien avant le mois de décembre,1
Mais on ne peut pas plaire à tout le monde,1
Sauf en étant hypocrite,1
Y'en a qu'ont toujours pas digéré ma lettre à la République,1
C'est la vérité qu'ils refusent car cette lettre n'est qu'un miroir,1
"Le jour où je présente mes excuses, c'est qu'je fais de l'humour noir",1
[Couplet 4: Kery James],0
"Tant mieux si ça les gêne, mais les miens s'y sont reconnus",1
"Et pour appuyer le système, t'auras toujours deux-trois vendus",1
T'auras toujours des traîtres et des négresses de maison,1
Qui pour quelques privilèges t'expliqueront que le maître est bon,1
T'auras toujours des envieux qui pour se démarquer,1
Se positionneront contre en espérant se faire remarquer,1
Observe leur arrogance et devine leur soif de pouvoir,1
Moi j'entends leur ignorance même quand ils étalent leur savoir,1
"Les Noirs sont affaiblis, oui, parce qu'ils sont désunis",1
"Le premier ""J"" qui nous ronge, c’est le ""J"" de la jalousie",1
Mais tu manques d'humilité pour remettre en question tes méthodes,1
Pour toi la révolution ne peut avoir lieu que sous tes ordres,1
"Mais j'ai déjà un prophète, je n'ai pas besoin de gourou",1
"On n'a pas le même combat, on ne frappe pas avec les mêmes coups",1
"Tu es manipulé, tu brises l'unité",0
C'est par des nègres comme toi que Malcom X fut assassiné,1
[Couplet 5: Kery James],0
"Il y aura toujours des ignorants, des lâches et des racistes",1
Des skins aux cheveux longs sous l'étiquette nationaliste,1
Entre la haine des autres et la fierté de soi il y a qu'un pas,1
Entre ma joue gauche et ma joue droite il y a mon bras,1
Il n’peuvent qu'agiter le leurre du racisme anti-blanc,1
Comme quoi il n'y a pas de couleur pour brandir de faux arguments,1
Alors j'rappe :,1
"1 Pour mes babtous, car on a besoin d'unité",1
Pour faire face au système qui veut diviser pour mieux régner,1
J'ai brisé mes chaînes et je ne cherche pas à être assisté,1
Je ne fais qu'évoquer l'histoire mais je ne vis pas dans le passé,1
"En parlant de passé, puisque les colonies c'est fini ;",1
Expliquez-moi ce que les soldats français faisaient en Libye,1
[Couplet 6: Kery James],0
Vous apportiez la Démocratie,0
C'est ce que croient les incultes que vos médias ont abrutis,0
Qui ?,1
Qui travaille pour qui ? Qui domine ?,1
"Qui est Bernard-Henry Lévy, qui le nomine ?",1
Qui ?,1
Qui répand toutes ces salades ?,1
Qui veut faire de Damas le nouveau Bagdad ?,1
Qui détruit les tombes des Saints sur le sol libyen ?,1
Qui prend en otage le peuple malien ?,1
Qui sont ces mercenaires ?,1
Qui les finance ?,1
Qui profite de ces guerres ? Quelles sont leurs conséquences ?,1
Qui distribue les rôles ? Qui décide ?,1
Pourquoi l'OTAN ne se déplace que pour certains génocides ?,1
Que se passe-t-il en Birmanie ?,1
Pourquoi les médias font un déni ?,1
Qui veut enflammer le Monde Musulman ?,1
Qui veut répandre le sang par la provocation ?,1
"Qui manipule les masses, qui déstabilise ?",1
Qui brandit le voile islamique pour cacher la crise ?,1
Eh ! L'heure est grave (grave),0
"Le Monde a pris un tournant, les vrais le savent (savent)",0
Pour le reste du troupeau brutal sera le réveil,0
"La France c'est mieux sans Nico, mais au final ça sera pareil",1
Te fais pas d'illusion va falloir passer à la caisse,0
Tu vas t'endormir en France et te réveiller en Grèce,1
"S'il y a eu un Printemps Arabe, il se peut que demain",1
La prochaine révolution soit un Printemps Européen,1
[Outro: Kery James],0
"Je suis un MC ma tâche est accomplie lorsque le peuple me dit ""merci""",0
"N'est pas MC qui veut, mon R.A.P. a quelques préceptes",1
Respecte ces quelques règles si tu veux en être,1
Elles sont au nombre de sept :,1
1 - Tu ne dois dire que la vérité,1
2 - Fais primer la qualité sur la quantité,1
3 - Fais ton choix entre le respect et le succès,1
"4 - Applique la première, t'auras pas besoin d'être vulgaire",1
5 - Ne suis jamais la mode,1
6 - Allie le fond et la forme en respectant tes propres codes,1
7 - Ne baisse jamais ton froc même si...,1
Ça les choque et que tu dois être le dernier MC !,1
